{
  "$schema": "https://json-schema.org/draft/2020-12/schema",
  "$id": "https://pep.local/workflow/schemas/critic-report.schema.json",
  "title": "Independent critic report",
  "type": "object",
  "additionalProperties": false,
  "required": ["schemaVersion", "role", "author", "reviewedSha256", "findings"],
  "properties": {
    "schemaVersion": { "const": 1 },
    "role": { "enum": ["education", "sme"] },
    "author": { "type": "string", "minLength": 1 },
    "reviewedPath": { "$ref": "#/$defs/path" },
    "reviewedSha256": { "$ref": "#/$defs/hash" },
    "artifactHashes": {
      "type": "object",
      "minProperties": 1,
      "propertyNames": { "$ref": "#/$defs/path" },
      "additionalProperties": { "$ref": "#/$defs/hash" }
    },
    "findings": { "type": "array", "items": { "$ref": "#/$defs/finding" } },
    "recheck": {
      "type": "object",
      "additionalProperties": false,
      "required": ["of", "items"],
      "properties": {
        "of": { "$ref": "#/$defs/path" },
        "items": {
          "type": "array",
          "items": { "$ref": "#/$defs/recheckItem" }
        }
      }
    }
  },
  "$defs": {
    "hash": { "type": "string", "pattern": "^[a-f0-9]{64}$" },
    "path": {
      "type": "string",
      "minLength": 1,
      "pattern": "^(?!/)(?!.*(?:^|/)\\.\\.(?:/|$)).+"
    },
    "recheckItem": {
      "type": "object",
      "additionalProperties": false,
      "required": ["findingId", "status", "file", "reviewedSha256", "note"],
      "properties": {
        "findingId": { "type": "string", "minLength": 1 },
        "status": { "enum": ["resolved", "open"] },
        "file": { "$ref": "#/$defs/path" },
        "reviewedSha256": { "$ref": "#/$defs/hash" },
        "note": { "type": "string", "minLength": 1 }
      }
    },
    "finding": {
      "type": "object",
      "additionalProperties": false,
      "required": [
        "id",
        "severity",
        "location",
        "claim",
        "evidence",
        "recommendation",
        "reviewedSha256"
      ],
      "properties": {
        "id": { "type": "string", "minLength": 1 },
        "severity": { "enum": ["critical", "high", "medium", "low"] },
        "location": {
          "type": "object",
          "additionalProperties": false,
          "required": ["file"],
          "properties": {
            "file": { "type": "string", "minLength": 1 },
            "selector": { "type": "string", "minLength": 1 },
            "line": { "type": "integer", "minimum": 1 },
            "column": { "type": "integer", "minimum": 1 }
          },
          "oneOf": [{ "required": ["selector"] }, { "required": ["line"] }]
        },
        "claim": { "type": "string", "minLength": 1 },
        "evidence": {
          "type": "array",
          "items": {
            "type": "object",
            "additionalProperties": false,
            "required": ["url", "section", "retrievedAt", "textSha256"],
            "properties": {
              "url": { "type": "string", "format": "uri" },
              "section": { "type": "string", "minLength": 1 },
              "retrievedAt": { "type": "string", "format": "date-time" },
              "textSha256": { "$ref": "#/$defs/hash" }
            }
          }
        },
        "recommendation": { "type": "string", "minLength": 1 },
        "reviewedSha256": { "$ref": "#/$defs/hash" }
      }
    }
  }
}
