{
  "schemaVersion": 1,
  "role": "education",
  "author": "pep-m-java-foundations-java-basics (Claude Opus 5.5)",
  "reviewedPath": "foundational-track/java-foundations/java-basics/arithmetic-comparison-and-logical-operators/artifact.html",
  "reviewedSha256": "035c786a429df33df62f13e3962d0c86e87ab596db58af4a0dc3d0e631609c34",
  "artifactHashes": {
    "artifact.html": "035c786a429df33df62f13e3962d0c86e87ab596db58af4a0dc3d0e631609c34",
    "artifact.md": "7ed34f6336cc8a07990358779ee2504e65486585d9da1153603e8ae19d087736",
    "artifact.gift": "f6b6acfb577ebbe72649efdbac98a1843c39750814a7a4c413f098c45c8c005f",
    "video-artifact.md": "11cde4ceb2120ed1acda035f75968e653d165d2b590c333946742841b5add29b",
    "topic.json": "a964c89400194ead76ed17b6015c08350294892d3ab06b2844a4af272c71ff96"
  },
  "findings": [],
  "recheck": {
    "of": "workflow/evidence/java-foundations/java-basics/arithmetic-comparison-and-logical-operators/critic-education.json",
    "items": []
  }
}
