{
  "schemaVersion": 1,
  "role": "sme",
  "author": "pep-r3-linux-md-regen (Claude Opus 5.5)",
  "reviewedPath": "foundational-track/git-linux-ai-foundations/git-foundations/stash/artifact.html",
  "reviewedSha256": "6a0684d0fc8ae100f3a58f7ba5add5f94ca18f63031fc68433a5105cbc220d1c",
  "artifactHashes": {
    "artifact.gift": "88c11e70ed3a4014014324453f93806e672adfc458c655bce1125598b071b966",
    "artifact.html": "6a0684d0fc8ae100f3a58f7ba5add5f94ca18f63031fc68433a5105cbc220d1c",
    "artifact.md": "9f953e79bd7051a8f365859209b6e44127024f67e4bdb15807013cd466f90991",
    "artifact.pdf": "eaab3426eef6b60f18dc4726c19dbe75d194660101959e96a5bd28c70e08632d",
    "topic.json": "93fa2cf7cee4c76d6bc1c289ef11193221bdd50393fd76887b4a70318368d6ff",
    "video-artifact.md": "44a51eed8c479b6d47f134a3ac3a56a58a62a88568520aad020f1b157dde5144"
  },
  "findings": [],
  "recheck": {
    "of": "workflow/evidence/git-linux-ai-foundations/git-foundations/stash/critic-sme.json",
    "items": [
      {
        "findingId": "coverage-qa-paths-current",
        "status": "resolved",
        "file": "workflow/evidence/git-linux-ai-foundations/git-foundations/stash/qa-paths.json",
        "reviewedSha256": "108c5fe7fd68d1b7c99748f15c8eb1192cc797364940587417dd7b9fbf237172",
        "note": "Coverage binding: qa-paths.json is byte-identical to bcfc82b and remains current; this companion/tooling recheck found no new technology finding against it."
      },
      {
        "findingId": "coverage-sources-current",
        "status": "resolved",
        "file": "workflow/evidence/git-linux-ai-foundations/git-foundations/stash/sources.json",
        "reviewedSha256": "2d9d411a7be35dbfdbf41b0dcaafe1dfcb10ebfca5613234081f0461c82d4181",
        "note": "Coverage binding: sources.json is byte-identical to bcfc82b and remains current; this companion/tooling recheck found no new technology finding against it."
      },
      {
        "findingId": "sme-git-001",
        "status": "resolved",
        "file": "foundational-track/git-linux-ai-foundations/git-foundations/stash/artifact.html",
        "reviewedSha256": "6a0684d0fc8ae100f3a58f7ba5add5f94ca18f63031fc68433a5105cbc220d1c",
        "note": "The prior stash-pop qualification remains resolved; unchanged HTML/GIFT and regenerated Markdown/PDF say removal follows a clean apply and conflicts retain the entry."
      }
    ]
  }
}
