{
  "schemaVersion": 1,
  "role": "education",
  "author": "claude-opus-5-5 (pep-c7-web-intake)",
  "reviewedPath": "workflow/evidence/html-css-js/intake.md",
  "reviewedSha256": "dbd6a0fde0133f06459bce0bb8cc7fe5f109d95e390313cca306ebb04a404387",
  "findings": [],
  "recheck": {
    "of": "workflow/evidence/html-css-js/intake-critic-education.json",
    "items": [
      {
        "findingId": "education-01",
        "status": "resolved",
        "file": "workflow/evidence/html-css-js/intake.md",
        "reviewedSha256": "dbd6a0fde0133f06459bce0bb8cc7fe5f109d95e390313cca306ebb04a404387",
        "note": "Still resolved on the current bytes at 40c2a926c2a616f15a5f0a326f74b52e9c8fe4b0. Lines 356-375 allocate every frozen Standard and Fast block, name the 62- and 54-minute Standard labs and 50-minute S27 build, count each page once, and explicitly retain the 80-, 50-, 60- and 58-minute Fast overflows for the external pacing decision rather than claiming that all pages fit."
      },
      {
        "findingId": "education-02",
        "status": "resolved",
        "file": "workflow/evidence/html-css-js/intake.md",
        "reviewedSha256": "dbd6a0fde0133f06459bce0bb8cc7fe5f109d95e390313cca306ebb04a404387",
        "note": "Still resolved on the current bytes. Lines 200, 222 and 247 distinguish page-terminal rehearsal from authentic performance and retain a learner-side first project step that scaffolds a throwaway Vite project, starts its real development server and confirms the local URL on both reuse routes."
      },
      {
        "findingId": "education-03",
        "status": "resolved",
        "file": "workflow/evidence/html-css-js/intake.md",
        "reviewedSha256": "dbd6a0fde0133f06459bce0bb8cc7fe5f109d95e390313cca306ebb04a404387",
        "note": "Still resolved on the current bytes. Line 201 retains the authentic Chrome-or-Firefox DevTools activity on the page's buggy script with line and conditional breakpoints, stepping, value inspection, fault identification and repair, while limiting the simulator to preparation and mapping prediction to the simulator and formative quiz."
      },
      {
        "findingId": "education-recheck-01",
        "status": "resolved",
        "file": "workflow/evidence/html-css-js/intake.md",
        "reviewedSha256": "dbd6a0fde0133f06459bce0bb8cc7fe5f109d95e390313cca306ebb04a404387",
        "note": "Still resolved on the current bytes. Lines 298-300 constrain FT12 work to completing provided function bodies: the scaffold supplies signatures, purpose comments, exports and title.trim(), so learners apply only the taught const, strict-equality and return-value skills before function syntax is taught on FT13."
      },
      {
        "findingId": "education-recheck-02",
        "status": "resolved",
        "file": "workflow/evidence/html-css-js/intake.md",
        "reviewedSha256": "dbd6a0fde0133f06459bce0bb8cc7fe5f109d95e390313cca306ebb04a404387",
        "note": "Still resolved on the current bytes. Line 273 specifies route-aware cumulative suites: Standard checks scaffold plus increment 4, Fast increment N checks scaffold plus increments 1 through N, learners run the current filter while working and plain npm test before completion; lines 319, 338 and 343 preserve the cumulative completion checks in the step sequence."
      },
      {
        "findingId": "education-recheck-03",
        "status": "resolved",
        "file": "workflow/evidence/html-css-js/intake.md",
        "reviewedSha256": "dbd6a0fde0133f06459bce0bb8cc7fe5f109d95e390313cca306ebb04a404387",
        "note": "Resolved on the current corrected bytes. Lines 288-301 now put a four-minute FT12 orientation before tool use, covering what npm ci and npm test do, a worked failing-output example, a quick outcome-identification check and pointers to the later full topics; command practice follows in a separate three-minute step, and the 70-minute total is preserved by reducing final test iteration from ten to seven minutes without removing an outcome."
      }
    ]
  }
}
