{
  "schemaVersion": 1,
  "role": "education",
  "author": "claude-opus-5-5 (pep-c8-react-intake)",
  "reviewedPath": "workflow/evidence/react/intake.md",
  "reviewedSha256": "51da2178a457be3f4d8b50adf381ff7c354b47cb652fbce061d466361d1befda",
  "artifactHashes": {
    "assessments/web-and-react-module-check/blueprint.json": "5aef8b6dabd805dd894784ac8e03fbbce0e35ee1ac29b0c7f56bd99994182567",
    "forms-context-and-crud/handling-submission-errors-in-forms/topic.json": "adf805760966de3a0550621615c58ff01de90d390d0e9791ecbad7d39a38c772"
  },
  "findings": [],
  "recheck": {
    "of": "workflow/evidence/react/intake-critic-education.json",
    "items": [
      {
        "findingId": "react-edu-001",
        "status": "open",
        "file": "standard-fast-track/react/assessments/web-and-react-module-check/blueprint.json",
        "reviewedSha256": "5aef8b6dabd805dd894784ac8e03fbbce0e35ee1ac29b0c7f56bd99994182567",
        "note": "Still open on the current bytes. The blueprint objectives remain React-only; evidence/react/intake.md:300 explicitly records that no html-css-js objective is listed and that this is not the finished Web and React coverage map. Resolve after stable html-css-js objective ids exist, as sequenced."
      },
      {
        "findingId": "react-edu-002",
        "status": "resolved",
        "file": "standard-fast-track/react/assessments/web-and-react-module-check/blueprint.json",
        "reviewedSha256": "5aef8b6dabd805dd894784ac8e03fbbce0e35ee1ac29b0c7f56bd99994182567",
        "note": "Resolved. The blueprint limits the fixed 45-minute sitting to Standard S35 and tells Fast learners only that the platform schedules the same check on FT20; evidence/react/intake.md:328 keeps the Fast block allocation explicitly open instead of asserting unsupported pacing."
      },
      {
        "findingId": "react-edu-003",
        "status": "resolved",
        "file": "standard-fast-track/react/forms-context-and-crud/handling-submission-errors-in-forms/topic.json",
        "reviewedSha256": "adf805760966de3a0550621615c58ff01de90d390d0e9791ecbad7d39a38c772",
        "note": "Resolved. The current manifest has only create-edit-and-delete-against-the-api as a prerequisite, and evidence/react/intake.md:95 preserves the frozen FT18 order while requiring just-in-time field- and form-level notification teaching before the later accessibility consolidation."
      },
      {
        "findingId": "react-edu-004",
        "status": "resolved",
        "file": "workflow/evidence/react/intake.md",
        "reviewedSha256": "51da2178a457be3f4d8b50adf381ff7c354b47cb652fbce061d466361d1befda",
        "note": "Resolved. The current calendar and minute-budget rows label FT19 Project implementation while retaining source snapshot dayType: Lab only as provenance, and the project plan states that Fast receives project implementation rather than a coding lab."
      },
      {
        "findingId": "react-edu-recheck-001",
        "status": "resolved",
        "file": "workflow/evidence/react/intake.md",
        "reviewedSha256": "51da2178a457be3f4d8b50adf381ff7c354b47cb652fbce061d466361d1befda",
        "note": "Resolved for the accepted narrowed claim. The new Project coverage claims table at lines 198-247 states the exact requirement taught, checked, applied and publicly tested for each part; compound objectives are explicitly partial and remain owned by their topic pages and quizzes. The minuted teach-before-apply sequence and fixed Fast and Standard block fits remain at lines 185-196 and 251-259."
      },
      {
        "findingId": "react-edu-recheck-002",
        "status": "resolved",
        "file": "workflow/evidence/react/intake.md",
        "reviewedSha256": "51da2178a457be3f4d8b50adf381ff7c354b47cb652fbce061d466361d1befda",
        "note": "Resolved. The S33 sequence teaches and checks CRUD reconciliation and duplicate-submit prevention before P3, then submission errors before P4 and Testing Library query choices before P5; the 24 teaching and 53 build minutes fit 77 of the 80-minute Build block."
      },
      {
        "findingId": "react-edu-recheck-003",
        "status": "resolved",
        "file": "workflow/evidence/react/intake.md",
        "reviewedSha256": "51da2178a457be3f4d8b50adf381ff7c354b47cb652fbce061d466361d1befda",
        "note": "Resolved. Lines 261-267 specify one all-stub starter, isolated per-part public tests selected through parts.json, distinct Fast and Standard activation orders, and solved-run validation of both entry paths without giving Standard solved P1-P2 bytes."
      },
      {
        "findingId": "react-edu-recheck3-001",
        "status": "resolved",
        "file": "workflow/evidence/react/intake.md",
        "reviewedSha256": "51da2178a457be3f4d8b50adf381ff7c354b47cb652fbce061d466361d1befda",
        "note": "Resolved for the accepted narrowed claim. The P5 row at line 235 marks o2 partial and defines present, absent and asynchronous uses of getBy, queryBy and findBy; line 259 makes those uses an observable learner outcome and requires the public tests to verify queryBy and findBy usage while the topic page owns the general query-choice objective."
      }
    ]
  }
}
