{
  "schemaVersion": 1,
  "role": "education",
  "author": "pep-r2-ai-module (Claude Opus 5.5)",
  "reviewedPath": "foundational-track/git-linux-ai-foundations/ai-foundations/foundations-course-check/artifact.html",
  "reviewedSha256": "5d90ca9bfff84f77c15120f867b7a1b0d3b6e218c73f1de4f83409f7806f5cee",
  "artifactHashes": {
    "artifact.html": "5d90ca9bfff84f77c15120f867b7a1b0d3b6e218c73f1de4f83409f7806f5cee",
    "artifact.md": "ea6be969f9792016ca2a293a88aba2f7a2b07120970d776ba2ef8f075cd901d0",
    "topic.json": "ab857d7698fb41ca2d7aa59578c55ea6a2041380a135ec73e52704b8e5aa79d7"
  },
  "findings": []
}
