{
  "schemaVersion": 1,
  "role": "sme",
  "author": "claude-opus-5-5 (pep-c6-python-intake)",
  "reviewedPath": "workflow/evidence/python/intake.md",
  "reviewedSha256": "8b9900cc427052ef227cc66252dfaf6c417a00e5c704b60f9655cb96d9fd95cd",
  "artifactHashes": {
    "assessments/python-module-check/blueprint.json": "ae5a33e0e6b740a8557a0d70623078424aaab23a1625f42499d68960c85eb194",
    "data-pipelines/loading-into-a-staging-table-with-upserts/topic.json": "ff8a2f28a0e31f957e0f62f952f48ba6eb1d44a2cdc3014a9026e6c7be75f8a7",
    "data-pipelines/module.json": "955d5d4693759e9cfce0a918ffafe395654bda6e982e77c5d3dc755101e5b670",
    "data-pipelines/reading-csv-and-json-files-with-generators/topic.json": "8a58f3774623016ee478c826683a65240abd9b45135e5e32f73836718ac972a6"
  },
  "findings": [],
  "recheck": {
    "of": "workflow/evidence/python/intake-critic-sme.json",
    "items": [
      {
        "findingId": "python-sme-001-fast-duration-unbound",
        "status": "resolved",
        "file": "standard-fast-track/python/assessments/python-module-check/blueprint.json",
        "reviewedSha256": "ae5a33e0e6b740a8557a0d70623078424aaab23a1625f42499d68960c85eb194",
        "note": "Resolved on the corrected bytes: dayId remains S19; the learner instructions scope the 15/30-minute parts to Standard S19 and state only that Fast learners take the shared check on FT11 with timing shown by the platform. The intake explicitly leaves FT11 timing and placement unresolved and states no Fast duration or split."
      },
      {
        "findingId": "python-sme-002-generator-memory-overclaim",
        "status": "resolved",
        "file": "standard-fast-track/python/data-pipelines/reading-csv-and-json-files-with-generators/topic.json",
        "reviewedSha256": "8a58f3774623016ee478c826683a65240abd9b45135e5e32f73836718ac972a6",
        "note": "Resolved on the corrected bytes: o1 distinguishes record-oriented CSV/JSON Lines from a small document read with json.load, and o2 limits bounded-memory behavior to sources read record by record while explicitly saying json.load materializes the whole document first."
      }
    ]
  }
}
