{
  "schemaVersion": 1,
  "role": "education",
  "author": "pep-r2-ai-module (Claude Opus 5.5)",
  "reviewedPath": "foundational-track/git-linux-ai-foundations/ai-foundations/module.json",
  "reviewedSha256": "527934046f9818b8cbcf510dcc13eac624d3a000484de7cda3fc4eecf0fdd4dd",
  "artifactHashes": {
    "agile-scrum-user-stories/artifact.gift": "e40a012192cf5ce9ed2ed4a8a30a66ae4f1d571f4270d6b6947265eed6a8a49b",
    "agile-scrum-user-stories/artifact.html": "6726ddfcb2eb3c8282507d86dec5daf2e5cca485c2589fdaffecda9317f07195",
    "agile-scrum-user-stories/artifact.md": "139475c614f51b7ffda769b7138fa1366b92eb32a136f8cf608c7f26fa08fb1b",
    "agile-scrum-user-stories/artifact.pdf": "acdda713f8b690d792b84a9bb1878cd2da1786dcecb2d073b285410339c49edb",
    "agile-scrum-user-stories/topic.json": "8f1f0dfc974583732764046076dad0ed7e13bf66d99c4503f60b8b1163fdd289",
    "agile-scrum-user-stories/video-artifact.md": "3ada65346cdcc4d34be12b58cad161441f4a627d6e4eb0e9f748281cf02e32fa",
    "ai-assistant-setup/artifact.gift": "fc2ed32998e9d7230a0c474958df0e697dbf8bafc59bacff37eb115822118f63",
    "ai-assistant-setup/artifact.html": "0bd3b721a45e86f4e7e53dca4197e77cffba798a23163048f4903271ac546f5c",
    "ai-assistant-setup/artifact.md": "ea2903e6150d8e0341a29fb303207fcc298bf24d61696ca43af9bceb5aed8c8b",
    "ai-assistant-setup/artifact.pdf": "26fac8693b1f17cceeaf60c92ec8ec09052a10f2f8f2c212efc54c305b57eeb6",
    "ai-assistant-setup/topic.json": "965c7017e0eb73d719d507e164c6e1e16dd57bbf9a9b4bb9324e01ad177bc761",
    "ai-assistant-setup/video-artifact.md": "0d9ab485c77a7c1f885fe0eb2325c59d76d6692382804b4f28fa6bed4f2d0b38",
    "ai-rules-of-use/artifact.gift": "b0455ba5ca119a072810833c5766dd70736f277ed4b0229656ca23a61721391c",
    "ai-rules-of-use/artifact.html": "8d8b035458165ece232a6962ca51f24ced6710af6a958d1ea58948ec2c7f323b",
    "ai-rules-of-use/artifact.md": "7c73474daf2d4c269ad9be2230e8b5726294fa745051bcd76066dff90817138e",
    "ai-rules-of-use/artifact.pdf": "4205abd2eba6890861658358f2a1596cbeeb98960a8a2802485f661825182e2a",
    "ai-rules-of-use/topic.json": "8c31faba960ca02a0e7c9fa4767402e7198d39458917ab0e3533d82a4ab88f99",
    "ai-rules-of-use/video-artifact.md": "85e4eafd9b117b0dc38ce14be61bf780b689776ad726d2ac22a5c286079acf26",
    "checking-ai-changes/artifact.gift": "512b986d444696e33369ce470574d8f828a96753dbd9ab5fbb0c5fdf482f6521",
    "checking-ai-changes/artifact.html": "d8cfd72692c96c8d464b8a4544dc90581a4afa567e99db47c51f846b9198327a",
    "checking-ai-changes/artifact.md": "6945e92a8e82bf8dec71f546cbbcb1616dbbf096064a62ec17904c4ebb42f1ff",
    "checking-ai-changes/topic.json": "7a915a5ba1a2c89554d0098b6bcfad5fa307b7a40dd9b135d71b7ea32d3babd1",
    "checking-ai-changes/video-artifact.md": "12447cbf26e2516862e627ee2fe0d433190b7c9cf7666e2cf1a94f8dd287e887",
    "foundations-course-check/artifact.html": "5d90ca9bfff84f77c15120f867b7a1b0d3b6e218c73f1de4f83409f7806f5cee",
    "foundations-course-check/artifact.md": "ea6be969f9792016ca2a293a88aba2f7a2b07120970d776ba2ef8f075cd901d0",
    "foundations-course-check/topic.json": "ab857d7698fb41ca2d7aa59578c55ea6a2041380a135ec73e52704b8e5aa79d7",
    "module.json": "527934046f9818b8cbcf510dcc13eac624d3a000484de7cda3fc4eecf0fdd4dd"
  },
  "findings": [],
  "recheck": {
    "of": "workflow/evidence/git-linux-ai-foundations/ai-foundations/module-critic-education.json",
    "items": [
      {
        "findingId": "education-1",
        "status": "resolved",
        "file": "foundational-track/git-linux-ai-foundations/ai-foundations/foundations-course-check/artifact.html",
        "reviewedSha256": "5d90ca9bfff84f77c15120f867b7a1b0d3b6e218c73f1de4f83409f7806f5cee",
        "note": "Still resolved on the current bytes. The title and h1 remain 'Practice: Foundations course review'; the opening labels low-stakes practice distinct from the Tooling module check; each answer-bearing refresher is hidden until the learner's first Check answer and hidden again on restart. The outcomes remain aligned."
      },
      {
        "findingId": "education-recheck-1",
        "status": "resolved",
        "file": "foundational-track/git-linux-ai-foundations/ai-foundations/ai-assistant-setup/artifact.html",
        "reviewedSha256": "0bd3b721a45e86f4e7e53dca4197e77cffba798a23163048f4903271ac546f5c",
        "note": "Still resolved on the current bytes. Objective o1 in topic.json, HTML and Markdown names three inputs the learner controls, while the teaching explicitly acknowledges other tool-supplied inputs and workspace reads."
      },
      {
        "findingId": "education-recheck-2",
        "status": "resolved",
        "file": "foundational-track/git-linux-ai-foundations/ai-foundations/checking-ai-changes/artifact.md",
        "reviewedSha256": "6945e92a8e82bf8dec71f546cbbcb1616dbbf096064a62ec17904c4ebb42f1ff",
        "note": "Resolved on the current bytes. The central diff is a fenced diff block with every context, removed and added line preserved separately. AI assistant setup and foundations course review render former definition-list/grid content as distinct labelled list rows. The regenerated AI assistant setup PDF preserves those rows in extracted text. Agile drag/drop placeholders remain separate labelled lines, and its existing static alternative supplies the complete interaction and feedback."
      },
      {
        "findingId": "AI-SME-R2-001",
        "status": "resolved",
        "file": "foundational-track/git-linux-ai-foundations/ai-foundations/checking-ai-changes/artifact.md",
        "reviewedSha256": "6945e92a8e82bf8dec71f546cbbcb1616dbbf096064a62ec17904c4ebb42f1ff",
        "note": "Resolved on the current bytes as independently confirmed during this education recheck: artifact.md lines 46-57 preserve the diff as a fenced, line-oriented block; ai-assistant-setup/artifact.md lines 37-43 and foundations-course-check/artifact.md lines 39-50 preserve labelled rows; pdftotext of the regenerated AI assistant setup PDF preserves the row boundaries."
      }
    ]
  }
}
