{
  "schemaVersion": 1,
  "role": "sme",
  "author": "pep-m-htmlcss-recheck-sme (OpenAI GPT-5.6-Sol)",
  "reviewedPath": "workflow/evidence/html-css-js/html-and-css/responsive-mobile-first-layout/sources.json",
  "reviewedSha256": "7cef9eec27ab4fa364c1ace5c401e10dcd6b5e5acd8354c89fc30796f5a8a418",
  "artifactHashes": {
    "artifact.gift": "3c6ecb5a6fc405e5f15bf147e0a673b6a3811642b72a31a614d7b0e4595685cf",
    "artifact.html": "349d2e9334faf17ee203a8b1ea14a20963e649e535010d7a0b1db4244f194e09",
    "artifact.md": "0d2b54b1a043628089fec20a032bea8001d5fc65c013fcaaad0372bca7ebe1dd",
    "topic.json": "dab4f0fd7201630420629a550bb4063d61f92f0b4bd633acdff6b654677de1c9"
  },
  "findings": [],
  "recheck": {
    "of": "workflow/evidence/html-css-js/html-and-css/responsive-mobile-first-layout/critic-sme.json",
    "items": [
      {
        "findingId": "responsive-mobile-first-layout-sme-01-task-instructions",
        "status": "resolved",
        "file": "workflow/evidence/html-css-js/html-and-css/responsive-mobile-first-layout/qa-paths.json",
        "reviewedSha256": "4869240ee1394ed968bc33bc90c734fe12d4a7ff1699dab512699999eb7aae29",
        "note": "Resolved. The current learner HTML uses an accessible four-item ordered list for every hands-on step, and this current QA route asserts all four labels before exercising each activity."
      },
      {
        "findingId": "responsive-mobile-first-layout-sme-02-timing-offset",
        "status": "resolved",
        "file": "workflow/catalog/html-css-js/html-and-css/responsive-mobile-first-layout/topic.json",
        "reviewedSha256": "dab4f0fd7201630420629a550bb4063d61f92f0b4bd633acdff6b654677de1c9",
        "note": "Resolved. modeledP50 is 7.98 and modeledWorstPath is 9.98, exactly P50 + 2.00; aboutLabel/budget are both 10."
      }
    ]
  }
}
