{
  "schemaVersion": 1,
  "role": "education",
  "author": "claude-opus-5-5 (c7-web-intake)",
  "reviewedPath": "workflow/evidence/html-css-js/intake.md",
  "reviewedSha256": "dbd6a0fde0133f06459bce0bb8cc7fe5f109d95e390313cca306ebb04a404387",
  "artifactHashes": {
    "course.json": "3ad6446bebc2626eda675a6d8859117da68959b919937231aaeb23c067f6d8bd",
    "dom-tooling-and-async/async-and-await/topic.json": "c4fcb123ab0764e77f3d136e73e68e77d576ebe77d1efa4fa71f8c298436039b",
    "dom-tooling-and-async/debugging-with-devtools-breakpoints/topic.json": "96f3dd9e9d7a11198945852cd5c7e5a608b34dbdb76db3b86eb8eca5a4e0370c",
    "dom-tooling-and-async/events-and-event-bubbling/topic.json": "70384f2eb49c254423ed1a4c429179b7403fe57b0c18f0981c78ab4a2f20eecb",
    "dom-tooling-and-async/module.json": "00ef2037b8d70798987dedf126d9345a9cf32d873c24fac15943f6f536286811",
    "dom-tooling-and-async/preventing-cross-site-scripting/topic.json": "403c1955bf0c0da7964041f7b26a54104da99ba767b451a13c0c46c5378de65c",
    "dom-tooling-and-async/project-setup-with-npm-and-vite/topic.json": "b2b6f662aacb5462fe54d4dd9150d100b745354f075d68f4f53cbaba6380b7b0",
    "dom-tooling-and-async/promises/topic.json": "7b71e844d4a6952210061de1c557db33c3dde2369123e03768ebddaf05d10b49",
    "dom-tooling-and-async/selecting-and-changing-the-dom/topic.json": "e502d06cc24bf9d50a6680364699db8df7e7d7576ae0bfb6004ea352569241db",
    "dom-tooling-and-async/the-event-loop/topic.json": "efd9d430cc5097fba01b8058ca8e5fc95be3db4f6504e8314d16559dee60f34a",
    "fetch-and-browser-client/calling-your-spring-boot-api-from-the-browser/topic.json": "90d26179040f0ad170ed8ea05cd671de6429f4c559d341cf2b14b55cadf5615d",
    "fetch-and-browser-client/cookies-vs-localstorage-where-tokens-should-live/topic.json": "4557f37d233a9334d0f75e9f02e166678c1463027bf8a02a465aa33d71379bd5",
    "fetch-and-browser-client/environment-settings-for-the-api-address/topic.json": "821ec921959932efa887ec24dddee4f4205dd66b2022e35e95de1d0d685f29a6",
    "fetch-and-browser-client/fetching-data/topic.json": "5db8dbf8ade2265358e424c9effebbd1306a971dda89651246cde757d1a469ff",
    "fetch-and-browser-client/fixing-cors-spring-security-config-vs-vite-dev-proxy/topic.json": "d03564caaf564e498d138ed47df477ec0258930b6c738d5c91a5a039b8ac62a8",
    "fetch-and-browser-client/handling-http-errors-and-problemdetail-responses/topic.json": "1e2849a6dde7a0a3b3c7567789a805cbb3f4e19b46d5d86124e591b95dd5dab5",
    "fetch-and-browser-client/module.json": "8ec7f1219085dc69f14ce61579eeaf8b5ff30b66aeb225c28a670f7c5a8b96a3",
    "fetch-and-browser-client/testing-a-plain-function-with-vitest/topic.json": "594e6c6917ef07b19e7792916284f3efadd9a8fe756d8c2625fc8f5fad936068",
    "html-and-css/accessibility-basics/topic.json": "37e3b729782781af46b2606e38f39b88d3aca5073788790e6c1b785a5fd69c8c",
    "html-and-css/flexbox/topic.json": "d1468ae4437dcdd84eb5597648951d4db5973c9fef7fdacc65fdb6e401a02bf4",
    "html-and-css/forms-and-html5-validation/topic.json": "c52e1938a19d3796745513f664590adddfb2eb56d62fc97d80f40d11cdd5c88d",
    "html-and-css/grid/topic.json": "64bb4538b515c2e3d43596dbe48307ab2dd57593efd46a537b6233adb1808184",
    "html-and-css/module.json": "8b1a9ce350a27ee9771876c68d47d551716ce088bd749c876a23d3bf0a446aca",
    "html-and-css/responsive-mobile-first-layout/topic.json": "45d152aab45ac115eebe3349d3fc50e8043e8b242718aededb1eb8f190656da0",
    "html-and-css/semantic-html-page-structure/topic.json": "0b6e44d2ffe1e1b07be7cf85db9473605ded1eed7b8fcf67a801c0e66f5aa988",
    "html-and-css/the-box-model/topic.json": "bcf77f0153cdd95d450a105a3032339e53490f62ad990e92bc2a3bd350f300e7",
    "javascript-fundamentals/arrays-and-objects-map-filter-reduce/topic.json": "ede112d293d0893a86a20692c7d429096ee8088b712a00fce286055a1d303b6f",
    "javascript-fundamentals/destructuring-and-spread/topic.json": "65763981b4510db3d00d8e2836d97e41c78faf121e81fcf9262ec0adf8cd8fb2",
    "javascript-fundamentals/functions-as-values-arrow-functions-and-callbacks/topic.json": "1238bac2a9869b206c1ad501dfa4fa072c59eb4246dec40a891a83cd2e07a63a",
    "javascript-fundamentals/javascript-for-java-developers/topic.json": "75e74910036d9e9f99d089d534655c9571efde5dade9908529a420fe1e90c652",
    "javascript-fundamentals/let-const-and-equals/topic.json": "ee137889f78d77950055932beee202669c42c2d39bacde9de4b586170dd5dad2",
    "javascript-fundamentals/module.json": "4ad6656c71894411da11405cb50587312e065131268f25027ede7bb320f09f46",
    "javascript-fundamentals/modules-import-and-export/topic.json": "329f443caa32e30a7a276baab274758c2a093ce88075bec61f3ce157f605a4ca",
    "javascript-fundamentals/scope-and-closures/topic.json": "3ab516af30944826f1bc22629697e8f89da70dfa38bae8948580ac1b8447b116"
  },
  "findings": [],
  "recheck": {
    "of": "workflow/evidence/html-css-js/intake-critic-education.json",
    "items": [
      {
        "findingId": "education-01",
        "status": "resolved",
        "file": "workflow/evidence/html-css-js/intake.md",
        "reviewedSha256": "dbd6a0fde0133f06459bce0bb8cc7fe5f109d95e390313cca306ebb04a404387",
        "note": "Still resolved on the current bytes. Lines 356-375 allocate every frozen Standard and Fast block, retain the 62- and 54-minute Standard labs and 50-minute S27 build, count each page once, and explicitly report the 80-, 50-, 60- and 58-minute Fast overflows rather than claiming they fit. The root-layout commit moved these intake bytes unchanged."
      },
      {
        "findingId": "education-02",
        "status": "resolved",
        "file": "standard-fast-track/html-css-js/dom-tooling-and-async/project-setup-with-npm-and-vite/topic.json",
        "reviewedSha256": "b2b6f662aacb5462fe54d4dd9150d100b745354f075d68f4f53cbaba6380b7b0",
        "note": "Still resolved on the current topic bytes and intake lines 200, 222 and 247. Objective o1 remains an authentic learner-side step that scaffolds a throwaway Vite project, starts its real development server and confirms the local URL on both reuse routes; the manifest change since the prior reviewed bytes only prefixes workflow/ to evidence paths."
      },
      {
        "findingId": "education-03",
        "status": "resolved",
        "file": "standard-fast-track/html-css-js/dom-tooling-and-async/debugging-with-devtools-breakpoints/topic.json",
        "reviewedSha256": "96f3dd9e9d7a11198945852cd5c7e5a608b34dbdb76db3b86eb8eca5a4e0370c",
        "note": "Still resolved on the current topic bytes and intake line 201. The authentic Chrome-or-Firefox DevTools activity still requires line and conditional breakpoints, stepping, value inspection, fault identification and repair, while the simulator remains preparation; the manifest change since prior review is path text only."
      },
      {
        "findingId": "education-recheck-01",
        "status": "resolved",
        "file": "workflow/evidence/html-css-js/intake.md",
        "reviewedSha256": "dbd6a0fde0133f06459bce0bb8cc7fe5f109d95e390313cca306ebb04a404387",
        "note": "Still resolved on the current bytes. Lines 298-301 constrain FT12 work to completing provided function bodies: the scaffold supplies signatures, purpose comments, exports and title.trim(), so learners apply only taught const, strict-equality and return-value skills before function syntax is taught on FT13."
      },
      {
        "findingId": "education-recheck-02",
        "status": "resolved",
        "file": "workflow/evidence/html-css-js/intake.md",
        "reviewedSha256": "dbd6a0fde0133f06459bce0bb8cc7fe5f109d95e390313cca306ebb04a404387",
        "note": "Still resolved on the current bytes. Line 273 specifies route-aware cumulative suites and requires plain npm test before completion; lines 319, 338 and 343 preserve cumulative completion checks through increments 2-4."
      },
      {
        "findingId": "education-recheck-03",
        "status": "resolved",
        "file": "workflow/evidence/html-css-js/intake.md",
        "reviewedSha256": "dbd6a0fde0133f06459bce0bb8cc7fe5f109d95e390313cca306ebb04a404387",
        "note": "Still resolved on the current bytes. Lines 288-301 retain a four-minute FT12 npm/test orientation before tool use, a worked failing-output example, an outcome-identification check and later-topic pointers, while preserving the 70-minute total."
      }
    ]
  }
}
