{
  "schemaVersion": 1,
  "role": "education",
  "author": "pep-m-htmlcss-recheck-edu (GPT-5.6)",
  "reviewedPath": "standard-fast-track/html-css-js/html-and-css/grid/artifact.html",
  "reviewedSha256": "7787824b7959348f5dbd7db6c36e44aa1d2f43b7d265fcbe026d3cd6a2e3c7bf",
  "artifactHashes": {
    "artifact.html": "7787824b7959348f5dbd7db6c36e44aa1d2f43b7d265fcbe026d3cd6a2e3c7bf",
    "artifact.md": "c80ee9f652ee2d77e84b81af10d95a020fe602f6cdab93ffdff7adb17b443cb0",
    "artifact.gift": "e24d468854d378495ee09d303f9ad617a4e27ff2a9e458164447c1e2dcca2177",
    "topic.json": "ffe25e094d26ed00e45a58e00d9b6d2fd66804d8be9825b1ad2afc475c943350"
  },
  "findings": [],
  "recheck": {
    "of": "workflow/evidence/html-css-js/html-and-css/grid/critic-education.json",
    "items": [
      {
        "findingId": "education-grid-task-structure",
        "status": "resolved",
        "file": "standard-fast-track/html-css-js/html-and-css/grid/artifact.html",
        "reviewedSha256": "7787824b7959348f5dbd7db6c36e44aa1d2f43b7d265fcbe026d3cd6a2e3c7bf",
        "note": "Resolved on current bytes. Each of the three hands-on activities now presents a numbered four-part Where to look / What to do / What to expect / How to know it is done procedure. Directions describe actions and observable outcomes without supplying the activity answer or reasoning."
      },
      {
        "findingId": "education-grid-keyboard-evidence",
        "status": "open",
        "file": "workflow/evidence/html-css-js/html-and-css/grid/qa-paths.json",
        "reviewedSha256": "90f4b124904dace77c9b228fc2dccd52aea9fb404ef9432ba16d1212a1e173bc",
        "note": "Open on current bytes. The added route proves document-start Tab order through reset, objectives, prediction, confidence, submit and the first control of step 2, and it performs one Shift+Tab transition. It does not naturally traverse the controls in steps 2 through 5 or prove every required control is reachable in forward and reverse order; the existing full keyboard route still activates those later controls after selector-targeted focus."
      }
    ]
  }
}
