{
  "schemaVersion": 1,
  "role": "education",
  "author": "claude-opus-5-5 (pep-r2-git-module)",
  "reviewedPath": "foundational-track/git-linux-ai-foundations/git-foundations/merge-conflicts/artifact.html",
  "reviewedSha256": "af9d97a5c380095da16e64d8b0431d2175144d1a3ba8fec532a812c499127219",
  "artifactHashes": {
    "artifact.gift": "e94297a6292c2f3750ccbcfc57292fa4587acf9760b7ef3e26842df1ba29263b",
    "artifact.html": "af9d97a5c380095da16e64d8b0431d2175144d1a3ba8fec532a812c499127219",
    "artifact.md": "0a4e3801e52c24895ebfd37ddfe8483ec334054fdad5848c4ac75135f3f216ed",
    "topic.json": "38a8ed17d08bcc33905105a4101857bf66148761b17ee990d5051ae042eaa367",
    "video-artifact.md": "e29c83f84b7c5537bc762a31e1d113cd56b226c43fdb49cb49d1231111e908f8"
  },
  "findings": []
}
