{
  "schemaVersion": 1,
  "role": "sme",
  "author": "pep-r2-ai-module (Claude Opus 5.5)",
  "reviewedPath": "workflow/evidence/git-linux-ai-foundations/ai-foundations/ai-assistant-setup/sources.json",
  "reviewedSha256": "c9416d3ff97fc8a9cf3c1b95287bcd83d716c7809f24c498f4e7f21658f45134",
  "artifactHashes": {
    "artifact.gift": "fc2ed32998e9d7230a0c474958df0e697dbf8bafc59bacff37eb115822118f63",
    "artifact.html": "0bd3b721a45e86f4e7e53dca4197e77cffba798a23163048f4903271ac546f5c",
    "artifact.md": "ea2903e6150d8e0341a29fb303207fcc298bf24d61696ca43af9bceb5aed8c8b",
    "artifact.pdf": "26fac8693b1f17cceeaf60c92ec8ec09052a10f2f8f2c212efc54c305b57eeb6",
    "topic.json": "965c7017e0eb73d719d507e164c6e1e16dd57bbf9a9b4bb9324e01ad177bc761",
    "video-artifact.md": "0d9ab485c77a7c1f885fe0eb2325c59d76d6692382804b4f28fa6bed4f2d0b38"
  },
  "findings": []
}
