{
  "schemaVersion": 1,
  "role": "sme",
  "author": "claude-opus-5-5 (pep-r1-course1-intake)",
  "reviewedPath": "foundational-track/git-linux-ai-foundations/assessments/tooling-module-check/blueprint.json",
  "reviewedSha256": "0739ae13f48652e4c89bc675f1177006ecc961dbcfcbbf4c59cae3e859d620c8",
  "findings": [],
  "recheck": {
    "of": "workflow/evidence/git-linux-ai-foundations/intake-critic-sme.json",
    "items": [
      {
        "findingId": "sme-02",
        "status": "resolved",
        "file": "foundational-track/git-linux-ai-foundations/assessments/tooling-module-check/blueprint.json",
        "reviewedSha256": "0739ae13f48652e4c89bc675f1177006ecc961dbcfcbbf4c59cae3e859d620c8",
        "note": "Rechecked the final blueprint. allowedResources and instructions limit the calendar-derived no-AI restriction to the 30-minute coding part; the 10-minute MCQ part explicitly leaves any additional resource rule to the platform assessment owner. This matches the separate F3 Quiz and 'Timed, without AI' blocks in workflow/curriculum/snapshot/pep-calendar.json."
      },
      {
        "findingId": "sme-03",
        "status": "resolved",
        "file": "foundational-track/git-linux-ai-foundations/git-foundations/merge-vs-rebase/topic.json",
        "reviewedSha256": "1a9c269d0218ceca9a128235922f163deb3435a76671f11b6520852bf0fe39c9",
        "note": "Rechecked objective o1 on the final bytes. It now distinguishes a merge commit for diverged histories from a fast-forward merge that only moves the branch pointer, consistent with the frozen official git-merge source."
      },
      {
        "findingId": "sme-05",
        "status": "resolved",
        "file": "foundational-track/git-linux-ai-foundations/linux-foundations/file-permissions/topic.json",
        "reviewedSha256": "962e0d17db7c72f9dace4c0f9fe9d4dd32a664d984beef11e3e0057014c88342",
        "note": "Rechecked objective o3 on the final bytes. It now limits the execute-bit requirement to direct ./script.sh execution and contrasts that with passing a readable script to Bash, consistent with the frozen execve(2) and bash(1) sources."
      },
      {
        "findingId": "sme-07",
        "status": "resolved",
        "file": "foundational-track/git-linux-ai-foundations/assessments/tooling-module-check/blueprint.json",
        "reviewedSha256": "0739ae13f48652e4c89bc675f1177006ecc961dbcfcbbf4c59cae3e859d620c8",
        "note": "Rechecked the final blueprint against all topic manifests. All 16 objectives are exact <course>/<module>/<topic>#<objective-id> references; objectiveFormats has exactly the same 16 keys, and every mapped value is one of the declared formats. The mapping gives 10 objectives to MCQ and six compatible hands-on objectives to three short coding tasks."
      }
    ]
  }
}
