{
  "schemaVersion": 1,
  "role": "education",
  "author": "claude-opus-5-5 (pep-c7-web-intake)",
  "reviewedPath": "workflow/evidence/html-css-js/intake.md",
  "reviewedSha256": "cd5e3abc57106acf2f8d532efc8a1c2397503d0b4f9c4f4b914d210a5c3102ef",
  "findings": [
    {
      "id": "education-recheck-03",
      "severity": "medium",
      "location": {
        "file": "workflow/evidence/html-css-js/intake.md",
        "line": 288
      },
      "claim": "Fast increment 1 still uses npm and the Vitest test workflow before either is taught. T0 tells an FT12 learner to run npm ci and npm test and interpret named test failures while explicitly saying npm is taught on FT13; Vitest is not taught until FT15. Labeling this procedural list Teach-then-check does not supply the plan's promised rule, worked example, quick check, or earlier page section, so the first increment's feedback loop depends on untaught tooling even though the plan says every applied concept is taught first.",
      "evidence": [],
      "recommendation": "Add a minimal FT12 orientation immediately before the commands that explains what npm ci and npm test do, shows the expected failing-test shape, checks that the learner can identify the failing outcome, and points to the later full npm/Vitest topics; rebalance the 70-minute increment without removing a frozen topic or block. Alternatively, provide an already-taught launcher for increment 1 while retaining npm test as the lab's declared language-native command.",
      "reviewedSha256": "cd5e3abc57106acf2f8d532efc8a1c2397503d0b4f9c4f4b914d210a5c3102ef"
    }
  ],
  "recheck": {
    "of": "workflow/evidence/html-css-js/intake-critic-education.json",
    "items": [
      {
        "findingId": "education-01",
        "status": "resolved",
        "file": "workflow/evidence/html-css-js/intake.md",
        "reviewedSha256": "cd5e3abc57106acf2f8d532efc8a1c2397503d0b4f9c4f4b914d210a5c3102ef",
        "note": "Still resolved on the current changed intake bytes at 939a04a5f866ad666a0a7849465a20d1f99d3969. Lines 357-376 continue to allocate every frozen Standard and Fast block, name the 62- and 54-minute Standard labs and 50-minute S27 build, count each page once, and retain the explicit 80-, 50-, 60- and 58-minute Fast overflows for an external pacing decision. The correction diff does not restore the original unsupported fit claim."
      },
      {
        "findingId": "education-recheck-01",
        "status": "resolved",
        "file": "workflow/evidence/html-css-js/intake.md",
        "reviewedSha256": "cd5e3abc57106acf2f8d532efc8a1c2397503d0b4f9c4f4b914d210a5c3102ef",
        "note": "Resolved on the current bytes at 939a04a5f866ad666a0a7849465a20d1f99d3969. Lines 292-298 now make the FT12 coding boundary explicit: T5 teaches learners to read provided function shells, and the scaffold supplies both signatures, purpose comments, the export line and title.trim(); learners are limited to the already introduced const bindings, strict-equality comparisons and return values. Function declarations, arrows and callbacks remain in FT13."
      },
      {
        "findingId": "education-recheck-02",
        "status": "resolved",
        "file": "workflow/evidence/html-css-js/intake.md",
        "reviewedSha256": "cd5e3abc57106acf2f8d532efc8a1c2397503d0b4f9c4f4b914d210a5c3102ef",
        "note": "Resolved on the current bytes at 939a04a5f866ad666a0a7849465a20d1f99d3969. Lines 273 and 299-347 define route-aware cumulative feedback: Standard npm test selects scaffold plus increment 4, while Fast increment N selects scaffold plus increments 1 through N; learners may filter to the current suite while working but must run plain npm test before completion. The authoring gate is required to exercise every route and expected summary."
      }
    ]
  }
}
