{
  "schemaVersion": 1,
  "role": "education",
  "author": "pep-m-htmlcss-keyboard-recheck-edu (GPT-5.6-sol)",
  "reviewedPath": "standard-fast-track/html-css-js/html-and-css/flexbox/artifact.html",
  "reviewedSha256": "a11f8d3bf8664255ded3896795b72a96fce81beb04301358e844ae3c8331923c",
  "artifactHashes": {
    "artifact.html": "a11f8d3bf8664255ded3896795b72a96fce81beb04301358e844ae3c8331923c",
    "artifact.md": "416d633d1bebb5a2a2a08c4f69f09f83e46abd481c006b58015890f328ee8a33",
    "artifact.gift": "27ffed5179e39606158c7cabd9fa485c73d1313ed0402777e9fdb76f93fb471a",
    "topic.json": "94a7e16bfd14af7a2da5cc852bc16cbf1276f49e51f412f097608a6dbdb4aba8"
  },
  "findings": [],
  "recheck": {
    "of": "workflow/evidence/html-css-js/html-and-css/flexbox/critic-education.json",
    "items": [
      {
        "findingId": "education-flexbox-task-structure",
        "status": "resolved",
        "file": "standard-fast-track/html-css-js/html-and-css/flexbox/artifact.html",
        "reviewedSha256": "a11f8d3bf8664255ded3896795b72a96fce81beb04301358e844ae3c8331923c",
        "note": "Resolved on current bytes. Each of the three hands-on activities now presents a numbered four-part Where to look / What to do / What to expect / How to know it is done procedure. Directions describe actions and observable outcomes without supplying the activity answer or reasoning. Independently reconfirmed at rebased head 0df5833bccfbc5cc6a96c48924eba6fb119325cc; the learner bytes are unchanged."
      },
      {
        "findingId": "education-flexbox-keyboard-evidence",
        "status": "resolved",
        "file": "workflow/evidence/html-css-js/html-and-css/flexbox/qa-paths.json",
        "reviewedSha256": "d636203ce3e0e6e7d5c7ebfa809f28aac51deb51c3ca07e6d7dba67724d42d83",
        "note": "Resolved on current bytes. A fresh isolated Chrome session executed the continuous simulator route from document start through every required control in dynamic steps 1-5 using only real Tab, Shift+Tab, Arrow, Enter, Space, text and chord key events; all forward/reverse focus assertions and control activations passed without selector focus. T11 and T12 pass, and the selector-targeted route remains supplemental."
      }
    ]
  }
}
