{
  "schemaVersion": 1,
  "role": "education",
  "author": "claude-opus-5-5 (pep-r2-git-module)",
  "reviewedPath": "foundational-track/git-linux-ai-foundations/git-foundations/merge-vs-rebase/artifact.html",
  "reviewedSha256": "9e69a85880f2ab1e6ec834c7c13fdb76616741dad1dbd4079d557ad8a938b1c7",
  "artifactHashes": {
    "artifact.gift": "d45f0546d3630399e31e2ef9df01b1fe89aba6051967dede30774449f7b51531",
    "artifact.html": "9e69a85880f2ab1e6ec834c7c13fdb76616741dad1dbd4079d557ad8a938b1c7",
    "artifact.md": "1cf4b279d5832cbb01f13bbce7f8464f8b3fb0fdbfa2d9169ae45966392cfaea",
    "artifact.pdf": "c7aeff6cab637cbb6bf2895f2ba7352e566db861460de01eaa50aa417d25946c",
    "topic.json": "d24258d00a9788ec62916b3fcda2d6482ffd52bd2b8e316adaecdbde9c3533ad",
    "video-artifact.md": "532a7de68e7b784e0f623d3edf26281f4239763839b3435d60c251fd1faa953b"
  },
  "findings": []
}
