{
  "schemaVersion": 1,
  "role": "sme",
  "author": "claude-opus-5-5 (pep-r2-git-module)",
  "reviewedPath": "foundational-track/git-linux-ai-foundations/git-foundations/module.json",
  "reviewedSha256": "595c526a35861e898cb1836fae78ba1323b155065e8a63ae5d396ca40305c9d1",
  "artifactHashes": {
    "branches-and-switching/artifact.gift": "9271642298bb3217484d2a57953c4c707d2b89960f11a45f682bcbbe0be14f24",
    "branches-and-switching/artifact.html": "d3ae5a9feb1a92cd7f7841f9b744371796ab12fa04bd411c166b15d44bc24408",
    "branches-and-switching/artifact.md": "8eb43cbbc919ab2c27ae5272e537774cbd2a3f0bfb1827ced81b7442c9a63a13",
    "branches-and-switching/topic.json": "bca3bb9a8e5f12cd35ddbe59aeb5acbe9fcdb7f9f3e17571d9bf3d6d30b551ac",
    "branches-and-switching/video-artifact.md": "53a88246ac075b8d70c73c2714fa9b91a7e49617dd4ce68c0516e962d0231dd5",
    "commits-diffs-and-gitignore/artifact.gift": "4a5155088d2e748b183972b3431856bdccfd1e34ef77b84c7adfb2ae865f6865",
    "commits-diffs-and-gitignore/artifact.html": "700b0ce64411a5b85890e2c463462c871c43b4597b55647ce1385514aa5adeeb",
    "commits-diffs-and-gitignore/artifact.md": "ac3a19eb45bffdbac1a0525344b0115402e7937a749085933b90b431140fae12",
    "commits-diffs-and-gitignore/topic.json": "c207d02a8396546ba3e8c47a88ab2930c264b03762b194a927fbfffd2f5194d2",
    "commits-diffs-and-gitignore/video-artifact.md": "220063e0d8f45d3730a8636ab0003f8ca3266f36cf722e0a6550b1e0c8fb0cd5",
    "git-and-shell-review/artifact.html": "ca06aebba10d41479a65edf86b56796768ba71c6fdeff737aa2ab4e2494ab9c9",
    "git-and-shell-review/artifact.md": "3aaf77d9b57ae9e50cb0276beeca0b526556cf607cd3856410558acc582020ec",
    "git-and-shell-review/topic.json": "6d13e846645c4cb5582469ae1149fa3e2fb08e192e84e310bf4d7c22d5d9b3bb",
    "merge-conflicts/artifact.gift": "e94297a6292c2f3750ccbcfc57292fa4587acf9760b7ef3e26842df1ba29263b",
    "merge-conflicts/artifact.html": "af9d97a5c380095da16e64d8b0431d2175144d1a3ba8fec532a812c499127219",
    "merge-conflicts/artifact.md": "0a4e3801e52c24895ebfd37ddfe8483ec334054fdad5848c4ac75135f3f216ed",
    "merge-conflicts/topic.json": "38a8ed17d08bcc33905105a4101857bf66148761b17ee990d5051ae042eaa367",
    "merge-conflicts/video-artifact.md": "e29c83f84b7c5537bc762a31e1d113cd56b226c43fdb49cb49d1231111e908f8",
    "merge-vs-rebase/artifact.gift": "d45f0546d3630399e31e2ef9df01b1fe89aba6051967dede30774449f7b51531",
    "merge-vs-rebase/artifact.html": "9e69a85880f2ab1e6ec834c7c13fdb76616741dad1dbd4079d557ad8a938b1c7",
    "merge-vs-rebase/artifact.md": "1cf4b279d5832cbb01f13bbce7f8464f8b3fb0fdbfa2d9169ae45966392cfaea",
    "merge-vs-rebase/artifact.pdf": "c7aeff6cab637cbb6bf2895f2ba7352e566db861460de01eaa50aa417d25946c",
    "merge-vs-rebase/topic.json": "d24258d00a9788ec62916b3fcda2d6482ffd52bd2b8e316adaecdbde9c3533ad",
    "merge-vs-rebase/video-artifact.md": "532a7de68e7b784e0f623d3edf26281f4239763839b3435d60c251fd1faa953b",
    "module.json": "595c526a35861e898cb1836fae78ba1323b155065e8a63ae5d396ca40305c9d1",
    "pull-requests-and-review/artifact.gift": "f1c74efbcef8725e0885eb1209b3f9da8356ff882332ab40735d615b2a9f7352",
    "pull-requests-and-review/artifact.html": "91e783c28484ea87bc941c7302e3f39b3abed043118689404603b078fbd48816",
    "pull-requests-and-review/artifact.md": "45395996112cf7398eae36f961e43dae74f90bba70078d15109d32d4224f1c8b",
    "pull-requests-and-review/topic.json": "2df46a4f9e9cf3738e54bd31b61825735337fe65ef1f4ee0ddcc0a56cb967b00",
    "pull-requests-and-review/video-artifact.md": "5e7de19c097be1e1cfbc4e6db9b10f8c32bb199d774acef5992990235bef11db",
    "remotes-clone-push-fetch-pull/artifact.gift": "67ad60b5ae33c75599b4cfa309165a5f16e56b214fd30109b663f4f34b4719db",
    "remotes-clone-push-fetch-pull/artifact.html": "3aedf30890acb518b87180e5d44b1373fcf5b311832b2c7ad4073700674abdb4",
    "remotes-clone-push-fetch-pull/artifact.md": "cb441bcb87841671a434f0979281af01d7981b20521b47ae95654f0a365ea87b",
    "remotes-clone-push-fetch-pull/topic.json": "7a0d913031392faba1ddae1a6c48aeac3e43ed79bb1d8bc92230ec4759ccf43d",
    "remotes-clone-push-fetch-pull/video-artifact.md": "6734d35ad1571ed9087790b3e7c05d9669afd11057d9d9202c2872ab5b1ea264",
    "stash/artifact.gift": "88c11e70ed3a4014014324453f93806e672adfc458c655bce1125598b071b966",
    "stash/artifact.html": "6a0684d0fc8ae100f3a58f7ba5add5f94ca18f63031fc68433a5105cbc220d1c",
    "stash/artifact.md": "edebe2f71a353ca77251d06134a6c57f5c4ff0096c449867f33e8557fc799d34",
    "stash/artifact.pdf": "98293671bf000f0ea1cbb3538edf6a439eca99d19bc36af075090e2b1375e8cb",
    "stash/topic.json": "93fa2cf7cee4c76d6bc1c289ef11193221bdd50393fd76887b4a70318368d6ff",
    "stash/video-artifact.md": "44a51eed8c479b6d47f134a3ac3a56a58a62a88568520aad020f1b157dde5144",
    "undoing-revert-and-reset/artifact.gift": "83022ac828e09011712e8cfdf0864b3a01f88a62e7635478ce79451084bf8f30",
    "undoing-revert-and-reset/artifact.html": "edf53065a03ab80ff2b6cc835949e328dc06d2aa2b7d776b7ba0bb6560f9f922",
    "undoing-revert-and-reset/artifact.md": "4957d6ebb1e0adf12517163408100aca9b6a010aefc8bd002cb3aa35e30d70f1",
    "undoing-revert-and-reset/topic.json": "0730086e2b25ff6eecce0a851f0d56dc00fe5da802c490f83fee2475af19799c",
    "undoing-revert-and-reset/video-artifact.md": "cb91688c93f0ce2613787fcff8930257be6cc929a6d01106829c7f44411d1ab5"
  },
  "findings": [],
  "recheck": {
    "of": "workflow/evidence/git-linux-ai-foundations/git-foundations/module-critic-sme.json",
    "items": [
      {
        "findingId": "sme-git-001",
        "status": "resolved",
        "file": "foundational-track/git-linux-ai-foundations/git-foundations/stash/artifact.html",
        "reviewedSha256": "6a0684d0fc8ae100f3a58f7ba5add5f94ca18f63031fc68433a5105cbc220d1c",
        "note": "Resolved on the current bytes: teaching, recap, cheat sheet, and GIFT feedback now limit removal to a clean apply and state that a conflicting pop keeps the stash entry until it is dropped. Reproduced with Git 2.50.1: a conflicting git stash pop exited 1, retained stash@{0}, and printed that the entry was kept."
      },
      {
        "findingId": "sme-git-002",
        "status": "resolved",
        "file": "foundational-track/git-linux-ai-foundations/git-foundations/merge-conflicts/artifact.html",
        "reviewedSha256": "af9d97a5c380095da16e64d8b0431d2175144d1a3ba8fec532a812c499127219",
        "note": "Resolved on the current bytes: the recap and GIFT feedback now describe same-area edits as a common conflict only when Git cannot combine them automatically, matching the accepted reconciliation."
      }
    ]
  }
}
