{
  "schemaVersion": 1,
  "role": "education",
  "author": "pep-m-sql-critic-edu (OpenAI Codex gpt-5.6-sol)",
  "reviewedPath": "foundational-track/sql-jdbc-foundations/relational-design/module.json",
  "reviewedSha256": "5d902bdc517254bbad08d7cd44a4d0624a0df4f750437726a6151bf700286c69",
  "artifactHashes": {
    "coding-lab/README.md": "d95837378d8a78b7b9be9979ebb50abfc7bb95174d6195961e7f476fa71edfa5",
    "coding-lab/expected/test-summary.txt": "697a015421017de714775b1917937332db795a5312552884f293199dd703868a",
    "coding-lab/lab.json": "2f26b299bf912ff9a481ff63638c88c9a14f0202bb8ecb3a65897854908850da",
    "coding-lab/starter/pom.xml": "88a3777bf1356022d34fadb8b6fc18c077c47b02a3edf6174ca4d12cd8f69ec2",
    "coding-lab/starter/schema.sql": "3396446bcf923683df9fa1316ba3a822b9787cfb23e4b4e85c245e8e1b563b1e",
    "coding-lab/tests/relational/LabDatabase.java": "a5fcc623a272559c54fb0eb2c9bcd76e058d96a17fd05f74e5dc58986b5d80df",
    "coding-lab/tests/relational/SchemaTest.java": "1b9fe4dc3c99392f30d65e4c0150e48b6c04d3df261caeea0baf76a39df0e47d",
    "create-table-data-types-and-constraints/artifact.gift": "5632b4eee9f9274fb261b081d333aec81b9eedef83f970ac53f260436b98cac4",
    "create-table-data-types-and-constraints/artifact.html": "a3d6af48c455ca1f7644e9c1682ea0c8416651dd8576545ae2e4c44b1c7681af",
    "create-table-data-types-and-constraints/artifact.md": "c93d4347d0511257ae994cf17476fa855b5a3d64352a90fe13c739b1b6166240",
    "create-table-data-types-and-constraints/topic.json": "24f407bd5fefbe72e7469459326d80e38b7ebc25915bdbbb3f19c080d3a34b5d",
    "create-table-data-types-and-constraints/video-artifact.md": "870c0fe5a4dc2f8b6358434fc6c0cf25fd2c34bca7e0b0a568817ad6b024d546",
    "designing-tables-from-a-user-story/artifact.gift": "09d47a632bd86915afd8a5dbf94abfe2f024598a59f6a6f7fad30fbaaf0b33f4",
    "designing-tables-from-a-user-story/artifact.html": "a09bd52f34de1dfc215134227255fd045aa780562b6bfa3990b60330b05da5c1",
    "designing-tables-from-a-user-story/artifact.md": "f4ec3214a6c714a2260072c1539b09be0c71128023156e32dcbe8fe94ddeaf09",
    "designing-tables-from-a-user-story/topic.json": "71f01c0058c1d87ae4ef7b43f9193cb9b5e4d021813a46036dbb41739cfd0566",
    "designing-tables-from-a-user-story/video-artifact.md": "f979f61a1a8741484679b855f3e9f48564998bb7d872e653db95f5ebb5bb37f8",
    "installing-postgres-and-a-sql-client/artifact.gift": "94311e2ddcdf71c5569a4526d1fd67f4cb537217c71bb408e1455759ba951663",
    "installing-postgres-and-a-sql-client/artifact.html": "8c1a32971923b74aa50da1b06cb972194f65b8f1c27be2192a4709286b87ec05",
    "installing-postgres-and-a-sql-client/artifact.md": "787aaf6fc904e75ff0d20e0a024cf554ceff416ad67ce02e0a5e2a299324854c",
    "installing-postgres-and-a-sql-client/artifact.pdf": "9f61593b255edc99ab8ed3c66477f9a1ea6b9b6d3f9c96e760aba08556d04493",
    "installing-postgres-and-a-sql-client/topic.json": "40e4fadb5730da32a899af6b9ae8df44a0659e3bcd7e5953c233629d79ccd870",
    "installing-postgres-and-a-sql-client/video-artifact.md": "1ff045241b7d8ee0a1c15a627502be23025ac5dde8b88ed10f284a225d11da89",
    "module.json": "5d902bdc517254bbad08d7cd44a4d0624a0df4f750437726a6151bf700286c69",
    "normalization-basics/artifact.gift": "b7969ad72075dfb15b607e381f0932fb65b482e02964662261547b6c781da26d",
    "normalization-basics/artifact.html": "24e88a528c8baa1840ee06203882f011ffd18d5a13951d71ab9f76b4e842727a",
    "normalization-basics/artifact.md": "74eeb37e00b2b2bfa52c0abe6539941ea915ced82ac96998f3ad01d8f7307634",
    "normalization-basics/artifact.pdf": "9d408af1a57c068ad63ed25c2f05d871ffcc4a4fd1cbae815d04c123f1f4aada",
    "normalization-basics/topic.json": "f18c4d66bccf7251d120c5e0209327d828f70a516f8102098f5fd1dc463b8a04",
    "normalization-basics/video-artifact.md": "9b68062ef37980660d38349468638a6f6aeba3e50e9ef75c990eae572ef5416b",
    "tables-keys-and-relationships/artifact.gift": "c4205a6fb19bf5c695ac4e4ffabcd29913c788b14654154ea13d2784f73e698d",
    "tables-keys-and-relationships/artifact.html": "ddf713129314e0937580958ad2c70e96f500dd36ced60722643222e6c3cbfe51",
    "tables-keys-and-relationships/artifact.md": "18855d9e7d6625bd3adea4a5dda2c818b8dc6c2268679e4e9bfae935d69130c2",
    "tables-keys-and-relationships/topic.json": "35165ef68323824307007a49115f11406a7c60afac02b45736117b35fbe955ce",
    "tables-keys-and-relationships/video-artifact.md": "345fda06ded1d73bd5ed45eb906f92f2279383a81cba3e1b45cb13c458bf2c13"
  },
  "findings": [
    {
      "id": "sql-relational-edu-001",
      "severity": "high",
      "location": {
        "file": "foundational-track/sql-jdbc-foundations/relational-design/installing-postgres-and-a-sql-client/artifact.html",
        "line": 246
      },
      "claim": "The module never teaches a learner how to install the local PostgreSQL server and psql that the title, accepted intake and module lab require. The page begins with \u201cYou installed PostgreSQL,\u201d relegates installation to \u201cfollow\u201d an external download page, and checks only psql client availability; it does not give a standalone, supported-OS path to install/start the server, create or identify a connectable database, and verify the client-to-server connection. A beginner without PostgreSQL cannot reach objective o2 or the module lab from these instructions.",
      "evidence": [],
      "recommendation": "Keep the fixed topic and objectives, but add concise in-artifact macOS, Windows and Linux installation routes. Give each route a numbered four-part procedure: where to act, what to do, expected server/client output, and a completion check. End with a real psql connection plus SELECT version(); and route common service, role, database and authentication failures to specific recovery steps; do not rely on the optional external link for required instructions.",
      "reviewedSha256": "8c1a32971923b74aa50da1b06cb972194f65b8f1c27be2192a4709286b87ec05"
    },
    {
      "id": "sql-relational-edu-002",
      "severity": "high",
      "location": {
        "file": "foundational-track/sql-jdbc-foundations/relational-design/coding-lab/tests/relational/SchemaTest.java",
        "line": 105
      },
      "claim": "The lab claims objectives that require choosing a suitable design, data types and constraints, but the public test accepts only one representation (for example text rather than another suitable character type for students.email and courses.code), while README task lines 73-76 disclose those exact expected types, key shape, defaults and constraints so learners can transcribe them. The design is also pre-specified down to every table and column. This makes the lab reliably passable only by giving away the decisions it claims to elicit, rather than authentically assessing tables-keys-and-relationships o3, designing-tables-from-a-user-story o2, or CREATE TABLE o1/o2.",
      "evidence": [],
      "recommendation": "Keep the fixed user story, module scope and no-container local-PostgreSQL route. Make public tests accept behaviorally equivalent suitable types/default expressions and validate acceptance criteria rather than one author representation. Retain only exact identifiers required by the test interface, remove the prescribed design/type/constraint answers from the task prompts, and let stable public feedback identify an unmet criterion without printing SQL. If some mapped objectives are not actually elicited after that change, narrow lab.json objectives rather than overclaiming coverage.",
      "reviewedSha256": "1b9fe4dc3c99392f30d65e4c0150e48b6c04d3df261caeea0baf76a39df0e47d"
    },
    {
      "id": "sql-relational-edu-003",
      "severity": "medium",
      "location": {
        "file": "foundational-track/sql-jdbc-foundations/relational-design/coding-lab/README.md",
        "line": 68
      },
      "claim": "The five lab tasks are one-line answer specifications followed by one shared Test section. They do not give each hands-on task the required four-part numbered procedure\u2014where to look, learner action, expected public feedback, and the observable completion criterion\u2014so a beginner must infer the edit/run/retry loop and which output marks each stage complete. The README also gives no clean way to restart schema.sql from the shipped starter after experimentation.",
      "evidence": [],
      "recommendation": "Rewrite each task as a short numbered four-part procedure that names starter/schema.sql and the relevant area, asks for the acceptance-criterion change without revealing SQL, tells the learner to run the one declared command and what failing-test feedback to expect, and names the relevant test passing as completion. Preserve retry and cleanup directions, and add a safe restart-from-starter instruction.",
      "reviewedSha256": "d95837378d8a78b7b9be9979ebb50abfc7bb95174d6195961e7f476fa71edfa5"
    }
  ]
}
