{
  "schemaVersion": 1,
  "role": "education",
  "author": "pep-m-sql-critic-edu (OpenAI Codex gpt-5.6-sol)",
  "reviewedPath": "foundational-track/sql-jdbc-foundations/relational-design/installing-postgres-and-a-sql-client/artifact.html",
  "reviewedSha256": "8c1a32971923b74aa50da1b06cb972194f65b8f1c27be2192a4709286b87ec05",
  "artifactHashes": {
    "artifact.gift": "94311e2ddcdf71c5569a4526d1fd67f4cb537217c71bb408e1455759ba951663",
    "artifact.html": "8c1a32971923b74aa50da1b06cb972194f65b8f1c27be2192a4709286b87ec05",
    "artifact.md": "787aaf6fc904e75ff0d20e0a024cf554ceff416ad67ce02e0a5e2a299324854c",
    "artifact.pdf": "9f61593b255edc99ab8ed3c66477f9a1ea6b9b6d3f9c96e760aba08556d04493",
    "topic.json": "40e4fadb5730da32a899af6b9ae8df44a0659e3bcd7e5953c233629d79ccd870",
    "video-artifact.md": "1ff045241b7d8ee0a1c15a627502be23025ac5dde8b88ed10f284a225d11da89"
  },
  "findings": [
    {
      "id": "sql-relational-edu-001",
      "severity": "high",
      "location": {
        "file": "foundational-track/sql-jdbc-foundations/relational-design/installing-postgres-and-a-sql-client/artifact.html",
        "line": 246
      },
      "claim": "The module never teaches a learner how to install the local PostgreSQL server and psql that the title, accepted intake and module lab require. The page begins with \u201cYou installed PostgreSQL,\u201d relegates installation to \u201cfollow\u201d an external download page, and checks only psql client availability; it does not give a standalone, supported-OS path to install/start the server, create or identify a connectable database, and verify the client-to-server connection. A beginner without PostgreSQL cannot reach objective o2 or the module lab from these instructions.",
      "evidence": [],
      "recommendation": "Keep the fixed topic and objectives, but add concise in-artifact macOS, Windows and Linux installation routes. Give each route a numbered four-part procedure: where to act, what to do, expected server/client output, and a completion check. End with a real psql connection plus SELECT version(); and route common service, role, database and authentication failures to specific recovery steps; do not rely on the optional external link for required instructions.",
      "reviewedSha256": "8c1a32971923b74aa50da1b06cb972194f65b8f1c27be2192a4709286b87ec05"
    }
  ]
}
